id,title,selftext,url,created_utc,num_comments,upvotes,subreddit
ob3upv,Can my work monitor my personal computer through remote desktop?,"I recently started a new job working remotely. I have a work laptop and some monitors they gave me to use. The thing is that I prefer my own home office setup which includes a couple of larger monitors on arms at my desk. If I used my personal computer to remote into my work laptop which is at home with me, is there any chance they can monitor my personal computers information/traffic through that connection. It doesn't seem like it to me but I like to make sure my personal data stays separate from my work life while still enjoying the home office I already have.",https://www.reddit.com/r/telecommuting/comments/ob3upv/can_my_work_monitor_my_personal_computer_through/,1625079125.0,12,5,telecommuting
gvgh93,How do you get a promotion when you work in a remote office?,"For good or ill, many people rely on in-person relationships to further their careers. It's one reason that some folks have been reluctant to work remotely; they miss out on the opportunities for lunch with the boss, or the brainstorm session in the hallway. ""Out of sight, out of mind,"" they say. But suddenly, with people working in home offices, everyone has to find new ways to show off.

I'm writing an article compiling practical how-to tips for people working from home on ""how to stay on your boss's radar"" and ""how to manage up."" What advice do you have to share?

Ideally: Give me a bullet point (""Do XYZ""), why (""It accomplishes \_this\_""), and perhaps an anecdote sharing how it made a difference.

Please don't expend energy telling me why it's important, or what the barriers are. Take that as a given. I'm looking for solid, actionable ""Do this"" suggestions from people who have personal experience or authoritative expertise.",https://www.reddit.com/r/telecommuting/comments/gvgh93/how_do_you_get_a_promotion_when_you_work_in_a/,1591133936.0,8,11,telecommuting
glhkc1,Remote Work: Can You Do It From Home? For How Long?,nan,https://tracklify.com/blog/remote-work-can-you-do-it-from-home-for-how-long,1589730324.0,4,35,telecommuting
4733yw,Telecommuting/remote work laws? [x-post from /r/legaladvice],"First of all, thanks for the responses in advance.

I'm moving to Northern Virginia, where I'll be residing for the foreseeable future. I was offered a relatively enticing full time remote work position in Miami (meaning, the office is in Miami but I would be working from home in NoVA full time), but before signing everything I'd really like to read up on remote work laws, particularly laws regarding working remotely from out of state.

I just really want to sort everything out and get more information, ranging from really important stuff like taxes (am I at risk of being taxed by both states?) to how does workplace law translate over to a remote work situation.

If you could point me over to a couple of resources where I could read into this or if you have any experience doing this kind of remote work, I'd be really grateful. Thanks!",https://www.reddit.com/r/telecommuting/comments/4733yw/telecommutingremote_work_laws_xpost_from/,1456176717.0,4,2,telecommuting
xdszrd,"iam looking for any remote work even if the money isn't much, i just want to work because life without work is very boring","iam looking for any remote work even if the money isn't much, i just want to work because life without work is very boring",https://www.reddit.com/r/telecommuting/comments/xdszrd/iam_looking_for_any_remote_work_even_if_the_money/,1663131709.0,5,7,telecommuting
nhxokr,Ultimate List of 100% Fully Remote Work From Anywhere Companies,"Hello everyone, I'm wondering if there is a site or list of all the companies that are fully remote and let you work from anywhere in the world? Or at least almost anywhere. I've seen a lot of companies offering remote options, but most of them don't specify if you can work anywhere or it's only remote within the US. I plan on not staying in the US long term, so I'm looking specifically for companies that don't care where you live in the world. I'll maintain an address and residency somewhere for tax purposes, but I want the freedom to travel to different places around the world while I work and not have to worry about my employer caring or finding out. Which companies allow this? Has anyone made a list or should we compile one together?

Your thoughts?",https://www.reddit.com/r/telecommuting/comments/nhxokr/ultimate_list_of_100_fully_remote_work_from/,1621617181.0,10,20,telecommuting
asfg4p,The Remote Work Danger Zone,"There are some positive things about working in an office with other people:

* People can have coffee/lunch together to build friendships;
* There are watercooler conversations that could turn into ""aha"" moments for the team;
* Information can be shared easily with a team member by simply walking over to someone else or standing up to make an announcement.

If a team is remote, these situations can't happen in a physical space, so people need to make an effort to create these types of experiences in a virtual environment. Even with the best of intentions and the cultural desire to make this happen, the reality is if a large majority of the team is co-located in an office, it's difficult to remember or see the need to include the people who work remotely. Companies have varying scenarios in which individuals are considered to be remote workers; some employees work in the main office, while others might work in satellite offices or from home. Moreover, some companies have no offices at all! There is a danger zone in terms of the number of employees in an organization that has some part of the team working remotely. Being in this zone can be very difficult for both the employee and the company.

Here's the spectrum I mean:  [https://imgur.com/a/ixze0Do](https://imgur.com/a/ixze0Do)

Let's look at the possible scenarios:

* **A company in which 100% of the employees work in one office**. In this scenario, the company has no employees that work remotely. Everyone is in the office five days a week, or maybe working from home is an unusual exception. There is no issue here because everyone benefits from the watercooler effect described above.
* **A company in which 99.9999% of the employees work in one office**. If one individual works remotely, he/she is not privy to all the watercooler benefits that being in an office would provide. However, the overhead costs needed to develop a remote-enabled infrastructure or culture for one remote employee doesn't make sense. The person who works remotely has the hardest time obtaining information from the team since he/she is easily forgotten and most communications and meetings happen face-to-face. You've probably seen it before: your public Slack channels are dead and the comments on your GitHub issues are non-existent. Unless the person really needs zero context apart from the tasks assigned to him/her, this isn't an issue. However, if the remote employee must make any decisions that depend on input from others, or if his/her input could be used to help make decisions, this could hurt the company. This negative outcome can occur until a large percentage of the company's work force is remote.
* **A company in which around 50% of the employees work remotely and/or in satellite offices**. Once a company has enough remote employees that must be included in conversations to move the company forward, the lack of information dissemination/conversations with everyone in the company has a major impact on the decisions that must be made for the organization. Once a company hits this point, moving to an asynchronous communication and implementing online company management strategies is really the only way to continue with the remote practices. Once this is established and people feel they are contributing to meaningful decisions, they can work from home, or, the key indicator, work from anywhere in the world without being less productive (or even more productive). This is an effective way to ensure the health of a remote-enabled company.
* **A company in which 100% of the employees work remotely**. Once the majority of a company's employees work remotely, and the organization is moving along smoothly, the hardest part is over. Growing to a situation in which 100% of workers are remote (if that's the desire) is not as challenging as going from 0% remote workers to 50% remote workers.

The key takeaway here is that while having a remote team creates a strong competitive advantage for a company, there are growing pains as teams shift from having a small number of individuals working remotely to a large number. Having this in mind during the growth phase will help the transition. Knowing is half the battle.

If you like this stuff, I'm writing a book on it. It's free until it's all done: [https://leanpub.com/remote-dev-teams/](https://leanpub.com/remote-dev-teams/). I also post random stuff here: [https://www.theremotecto.com](https://www.theremotecto.com)",https://www.reddit.com/r/telecommuting/comments/asfg4p/the_remote_work_danger_zone/,1550610575.0,2,11,telecommuting
wc01dt,How to get a US or EU-scaled salaried software engineering remote job outside of these countries?,"I'm a mobile developer. I see a lot of remote jobs posted from the US and EU scaled around 60-120k/year. I feel I'm confident to hold these jobs but when I apply for these jobs maximum time it says candidates must be in US or EU regions. But for some unavoidable issues, I can't leave my country but my current job's salary scale is too low to maintain a healthy and smooth lifestyle. I feel if I can manage a remote job which a scale just like US or EU then it will be possible for me to maintain a sound lifestyle in my own country by spending some extra money. Some of my questions are -

&#x200B;

* How to and from where can I be able to get a remote job offer without regional barriers? 
* Which common skills are required most to overcome this barrier?",https://www.reddit.com/r/telecommuting/comments/wc01dt/how_to_get_a_us_or_euscaled_salaried_software/,1659194902.0,18,12,telecommuting
8vfmwi,I'm really confused and need guidance to start remote work as a fresher,"Hello lovely people here, I am from Indian and after my Bachelors ( B.Tech. ) in ICT I got depressed as my grades were miscalculated so I fought with them and completed and came home in July '17 and after 10 months I have started applying here for office jobs as well but I'm having really bad experience in terms of people offering as shitty as 

# US$150 per month.

Which makes me feel really low. Though I am just fascinated by the work and technology that I can use to create and put on any web apps that I could. 

* I have been practicing Python Django and then I moved to Node.js Express.js MongoDB and I have practiced to create several complete apps with server side rendering with EJS templates. 

* I am also planning to start with LeetCode to get better jobs in as fast as 3-6 months because any job I will get will be really low paying ( Rs30k ~ US$440 per month).

So the jist is can you guys please tell suggest on what things I should try/practice and work upon, I am definitely going to go through the top post on this sub and try to read, search, implement as much as I can in my real life.

 * But I would love to hear from you guys your opinions on how should I proceed and what things should I take care of to avoid pitfalls from your experiences.

> PS.: I also used to write stage plays drama in college and do acting and direction so does that skill ( especially writing) will let me earn jobs online that would be let me be DigitalNomad


EDIT: forgot to mentions that /u/istareatscreens , mentioned to come to this sub on one of my post in r/cscareerquestionsEU",https://www.reddit.com/r/telecommuting/comments/8vfmwi/im_really_confused_and_need_guidance_to_start/,1530503396.0,11,2,telecommuting
432edl,New Remote Job. Need help with socializing.,"I just landed an excellent job that will challenge me in my career.  I work in Cloud.  The great thing besides nearly doubling my salary is that I work remote.

This is a double edge sword for me.  Where I came from in my previous company was a Google-esque company.  Very engaging and frenetic in a good way.  You always had people around you.  It was to a point it was almost invasive, but the company culture changed a few years back and now it's being a bit stagnant and has silos.

I still thing going in the office and having the option to work from home on days is great.  I'm not sure about the 100% remote thing.  I'm a bit scared that I will self isolate myself.

I also think that I will be one of the younger guys there being in my early 30s.  My last company much of the work force was under 35. So there may be a slight culture shift for me.

The company itself seems very engaging and still much into a start up mode and there will be travel.  No doubt about the company.  I just feel that remote work will make me go crazy and I won't be able to have a social life.  I fear being alone.

What do you guys do to cope with this?  ",https://www.reddit.com/r/telecommuting/comments/432edl/new_remote_job_need_help_with_socializing/,1453968507.0,8,5,telecommuting
xcozjf,My laptop shuts off or freezes. Best options to get laptop working with Remote Desktop?,"So I have AnyDesk and TeamViewer both on my remote desktop in case one crashes I have a backup.

The stupid laptop sometimes auto updates. And there is no easy or real way to shut that off. 

I want to buy a Smart Outlet and shut off the computer with it remotely. And once I do that I want the computer to restart and open up AnyDesk.

How do I do that or other options? Without me or someone physically there to turn it off and on with the button.",https://www.reddit.com/r/telecommuting/comments/xcozjf/my_laptop_shuts_off_or_freezes_best_options_to/,1663018708.0,3,2,telecommuting
aa0sbl,"WeWorkRemotely, RemoteOk, Remotive are in One Service!!"," I'd love to share with you a service that aggregates jobs from websites like WeWorkRemotely, RemoteOK, Remotive, Upwork, StackOverFlow, RobertHald, RealStaffing.

You save up to 10 hours per week by getting a personal list of jobs that fit your skills and have a high chance of hiring.

It finds remote or otherwise flexible jobs leveraging AI. 

I'm sure that it helps you![https://periodix.net/](https://periodix.net/)",https://www.reddit.com/r/telecommuting/comments/aa0sbl/weworkremotely_remoteok_remotive_are_in_one/,1545929294.0,0,1,telecommuting
larze7,Do my business partner need a work permit in EU to work remote?,"So we are a couple of guys that are developing a game atm.  
I am from Denmark  
and the other two are from England and Finland.  
Would the guy from England need a work permit in Denmark/EU, to be able to work remotely from England, to the company in Denmark?",https://www.reddit.com/r/telecommuting/comments/larze7/do_my_business_partner_need_a_work_permit_in_eu/,1612258556.0,4,9,telecommuting
b8z49i,Remote workers and their relationship with management,"I'm currently doing research on remote workers and their relationship with management, and I would like to hear the opinions of people who work remotely to help improve this important relationship.

&#x200B;

Working remotely can also be called teleworking, telecommuting or ""working from home"", so any worker who does all or part of their work away from the physical office of their employer. To participate, you must work remotely more than 2 days per week, been doing so for more than 3 months and have someone who supervises your work. I'm looking for input from any country, industry or job type, just as long as you work away from the office, so please share the link with other friends who may also wish to participate.

&#x200B;

(Edit) Note: If a question does not apply to you, please leave the answer blank.

&#x200B;

Your input can help companies improve their teleworking programs and make it more enjoyable for everyone involved. Please see the link below for details and a short survey. Thank-you.

&#x200B;

[http://telework.hostedincanadasurveys.ca/index.php/266832?lang=en](http://telework.hostedincanadasurveys.ca/index.php/266832?lang=en)

&#x200B;

(Survey closes Apr 28, 2019)

&#x200B;

p.s. The picture is my supervisor sleeping on the job, again.

&#x200B;

&#x200B;

https://preview.redd.it/4d97lfeyd2q21.jpg?width=1320&format=pjpg&auto=webp&s=41e992d4da40fbc0636fc5e69d1a986d9f12ce18",https://www.reddit.com/r/telecommuting/comments/b8z49i/remote_workers_and_their_relationship_with/,1554303930.0,7,10,telecommuting
7dak2v,Starting to work from other coast. any advice for new remote workers?,"I insisted on the move to SF as my gf is there. My team is in nyc. I am a developer who would interact with my team and users of my product on a day to day basis.

my manager seems to be ok with me working in remote office. But now am a bit worried about not being part of the team and getting trapped in ""out of site or if mind"" case.

what precautions and gotchas should I be aware of? ",https://www.reddit.com/r/telecommuting/comments/7dak2v/starting_to_work_from_other_coast_any_advice_for/,1510813255.0,5,2,telecommuting
avio6w,remote only job site for well paid jobs - www.freemoter.com,"Hi guys, i have built a remote only job site for well paid jobs. work you can do from anywhere in the world. get jobs by entering your skill set, email alerts, category search or simply browse the most current jobs list. we focus on high quality jobs and make it as easy as possible for the user to navigate through the search. love to hear what you think and what to improve. cheers Nazar
www.freemoter.com",https://www.reddit.com/r/telecommuting/comments/avio6w/remote_only_job_site_for_well_paid_jobs/,1551302849.0,9,11,telecommuting
6fpgfz,Best Remote Jobs For Sales,"I've been working in sales for a very large tech company in Seattle for the past three years. I'm looking for extra income to support my travelling. I took a year off to travel in Asia and coming back to the office just isn't cutting it anymore. I don't need a 6-figure job anymore. I'd be happy making $2k/month on a beach in Central America working 4-6 hours a day.

Where do I go from here?",https://www.reddit.com/r/telecommuting/comments/6fpgfz/best_remote_jobs_for_sales/,1496789824.0,2,4,telecommuting
3gl4lz,Trying to get into the remote work field.,"Hey everyone,

I found this subreddit, and it is inspiring how many people telecommute. I checked a few of the websites that I found here, only to find mostly developer jobs.

I am a middleware administrator / linux sysadmin and i didn't find many companies that are looking for administrators. Is the main audience for remote work developers on short term contracts? 

Is there a space for administrators for full time longer contracts to work remotely? I plan to have a further look once i get home(1 hour by train :/) , but would love some input from more experienced people.

Thank you !",https://www.reddit.com/r/telecommuting/comments/3gl4lz/trying_to_get_into_the_remote_work_field/,1439297007.0,7,4,telecommuting
br6scp,Remote UX jobs?,Any chance anyone hear has had luck landing remote UX positions from any of the remote job listings?,https://www.reddit.com/r/telecommuting/comments/br6scp/remote_ux_jobs/,1558418858.0,1,3,telecommuting
95c89z,Please help my research on virtual teams and remote work!,"Hi all, I would like to start my digital nomad path and as such picked it also for my thesis research. I would like to leverage the experience of you guys.

If you want to help me and are a millennial between 20 and 35 years with experience in virtual teams, I would be happy to hear from you!

Below is the survey for my thesis (6 minutes of work)

Survey on Microsoft Forms [HERE](https://forms.office.com/Pages/ResponsePage.aspx?id=s6RRKz9EBkSMpBkFanmkRNe_aeuJuvtHtqU_zaouRsNUNUJDRUFNRVMzT1A2RDUyTUswNlU3RkNMUi4u)

Thanks   
If you even share it with your network, you will have my endless appreciation!

And if you are interested in the result of the research, please PM me your e-mail!",https://www.reddit.com/r/telecommuting/comments/95c89z/please_help_my_research_on_virtual_teams_and/,1533653013.0,2,4,telecommuting
6xdhvi,WorknRemote is the perfect place to post and find jobs that allow working from anywhere of the world. Post Job and make your next perfect hire from the most unexpected locations.,nan,https://worknremote.com/#!/,1504258923.0,0,8,telecommuting
45zsz3,Can non senior developers land remote jobs?,I mostly see ads from companies that allow remote looking for senior level engineers. Do us non seniors have a chance? ,https://www.reddit.com/r/telecommuting/comments/45zsz3/can_non_senior_developers_land_remote_jobs/,1455583179.0,14,4,telecommuting
457e6q,Seeking a remote job (foreign country),"Hi, there! .. I just graduated from college a few months ago.

I was exploring the telecommuting environment and I want to know if I have any chance of getting a remote job in other words, I want to explore.. 

I'm looking a remote job in the IT sector. I don't know.. maybe answering tickets, Database manager, Programming, etc. I can understand most of things in English but I'm still working on my pronunciation, I'm a native spanish speaker.. Thanks",https://www.reddit.com/r/telecommuting/comments/457e6q/seeking_a_remote_job_foreign_country/,1455170213.0,6,2,telecommuting
9ooigl,Remote Job Board up for Sale on Flippa,Great remote work only on sale. Click [here](https://flippa.com/9986869-generationremote-com) for details and place your bid. Highest bidder owns the right to earn passive income from a job board with growing audience in an industry that shows upward trend.,https://www.reddit.com/r/telecommuting/comments/9ooigl/remote_job_board_up_for_sale_on_flippa/,1539702733.0,0,1,telecommuting
9fre6v,Question from an employer about starting to have remote employees,"I've been trying to push the rest of the leadership team where I work to be more accepting of remote workers.

I am not a lawyer, so I don't know how to respond to one particular question that came up.

In the days before telecommuting, it was normal that the country that someone lived in was always the same as the country of the employer. And so if a company was incorporated in country A, then of course everyone employed by the company had to have the right to work in country A because otherwise they wouldn't be able to turn up to the office.

I always assumed that a visa that gave you the right to work in a country was giving you the right to live in that country and work there. I always assumed that if you are employing someone from country B when your company was incorporated in country A, that the employee needed a ""right to work"" in country B only. Work rights to country A were irrelevant if the person was never going to step foot in country A.

But everyone else seems to assume that in that situation, the employee needs work rights in country A as well, even though they will never pass through immigration in country A, so no-one will ever know whether they actually had work rights there or not.

Does anyone know what the situation is?

P.S. Australian company, but I think it's an interesting question for all sorts of countries.",https://www.reddit.com/r/telecommuting/comments/9fre6v/question_from_an_employer_about_starting_to_have/,1536926480.0,1,8,telecommuting
4x3h5j,Research on remote working,"'A virtual team (also known as a geographically dispersed team, distributed team, or remote team) is a group of individuals who work across time, space and organizational boundaries with links strengthened by webs of communication technology'.

Hi all,

I am conducting a piece of academic research on the leadership issues that arise from managing remote teams.

I am looking to ask managers or business owners who have worked with a remote team in the past (or currently still doing so) some questions about your experiences.

I only have a few questions and I would appreciate it if you would help me out on my research. Please PM me if you are interested and I will send along more information.

This is a great way for your experience and knowledge to be used to progress research on this great topic. No personal information will be gathered for the research as the research is fully anonymous.

Alternatively: Are you a remote worker (freelancer/employee) currently being managed? I may also have a few questions for you too. Feel free to PM me if you wish to help.

Thank you for your time.",https://www.reddit.com/r/telecommuting/comments/4x3h5j/research_on_remote_working/,1470852250.0,0,2,telecommuting
4ckzsn,Live From Remote Year: On Working & Traveling With Your Tribe,nan,https://medium.com/life-travel-work/live-from-remote-year-on-working-traveling-with-your-tribe-f9792f5c2d3b#.rh60wxnoq,1459348190.0,0,0,telecommuting
