id,title,selftext,url,created_utc,num_comments,upvotes,subreddit
1bfmej6,I work in remote sales as a closer (My story with it + Q&A),"Howdy everyone! I wanted to share my experience with remote sales because it massively changed my life for the better and figured I'd share my experience as well as tips if this is something you're looking to consider as a remote job.

\_\_\_\_\_\_\_\_\_\_\_\_\_\_\_\_\_\_\_\_\_\_\_\_\_\_\_\_\_\_\_\_\_\_\_\_\_\_\_\_\_\_\_\_\_\_\_\_\_\_\_\_\_\_\_\_\_\_\_\_\_\_\_\_\_\_\_\_\_\_\_\_\_\_\_\_\_\_\_\_\_\_\_\_\_\_\_\_\_\_\_\_\_\_\_\_\_\_\_\_\_\_\_\_\_\_  
**Before I Started**

Before I started working from home in sales, I worked for t-mobile for 3 years, and before that I worked with Sprint for 2 years before they merged into t-mobile. I had at that point 100% customer service experience, making 2.6k/m after tax + benefits. Honestly thought I was going to retire there. 2022 came around and t-mobile made a lot of changes that actually ended up hurting my bonuses I'd normally get from selling phones and adding lines. Dropped as low as 1.9k/m. To me, at that time, was was a big pay drop. A close friend of mine, got even more screwed with those changes. He went from making 3.3k/m down to 2.1k/m after the changes. It was rough but honestly, was prepared to keep working there. My friend, however, did not.

\_\_\_\_\_\_\_\_\_\_\_\_\_\_\_\_\_\_\_\_\_\_\_\_\_\_\_\_\_\_\_\_\_\_\_\_\_\_\_\_\_\_\_\_\_\_\_\_\_\_\_\_\_\_\_\_\_\_\_\_\_\_\_\_\_\_\_\_\_\_\_\_\_\_\_\_\_\_\_\_\_\_\_\_\_\_\_\_\_\_\_\_\_\_\_\_\_\_\_\_\_\_\_\_  
**How I Started**

My friend took all his PTO and took 4 weeks off. He hit me up 2 weeks after he ""left"" saying he got a job as a remote closer. After he received his first paycheck, which was around 10k, he quit t-mobile at the drop of a hat. He went through a program he paid 10k for to get training, interviews, and placements. Worked for him because he was also a retired cop so he had money to put into something like that, I didn't. So shopping around, I ran into a program called **7 Figure Sales Academy,** I booked a call with them, told them I had someone doing this thing making good money, but could not afford the 10k for everything (NOTE: This is not the company my friend went with). They set me up with 3 monthly payments of **1k** for a total of **3k** for just training. I talked with my misses, and decided it was worth it.

\_\_\_\_\_\_\_\_\_\_\_\_\_\_\_\_\_\_\_\_\_\_\_\_\_\_\_\_\_\_\_\_\_\_\_\_\_\_\_\_\_\_\_\_\_\_\_\_\_\_\_\_\_\_\_\_\_\_\_\_\_\_\_\_\_\_\_\_\_\_\_\_\_\_\_\_\_\_\_\_\_\_\_\_\_\_\_\_\_\_\_\_\_\_\_\_\_\_\_\_\_\_\_\_  
**Starting the Process**

So the training was great, learned a lot of sales skills, met some really nice people during group training sessions, was pumped to try out being a salesman after I finished the course in 4 weeks! **HOWEVER,** I struggled to get jobs. Some of them on linkedin were scams, some of them wanted me to already have closing experience, and just 2 months of no responses. I felt like no one wanted a guy with 0 sales experience, even if I had training.

My friend, who was consistently making 14k/m at his remote job, told me to give the company he went through a shot. Now I was 3k in the hole with nothing to show for it but seeing his success, I felt like I might as well since I already got this far. Reached out to the company he worked with \[**Elite Closers**\], agreed to pay **1k down, 500/m until I paid off 9.8k total.** I was able to get the vetting/training done in 4 weeks, and after that I was able to do my first interview on my 5th week. I was hired the following Monday! Now at that point I was **4.5k invested,** nothing to show for it but powered through.

I was placed with a company called **Michael Blank,** who does multi-family real estate syndication/masterminds. First month, made 7k but hell yea, 3x better than what I was making before. I quit my job at t-mobile, went full time my second month with them, made 14.2k my second month, and paid off everything I owed to Elite Closers.

\_\_\_\_\_\_\_\_\_\_\_\_\_\_\_\_\_\_\_\_\_\_\_\_\_\_\_\_\_\_\_\_\_\_\_\_\_\_\_\_\_\_\_\_\_\_\_\_\_\_\_\_\_\_\_\_\_\_\_\_\_\_\_\_\_\_\_\_\_\_\_\_\_\_\_\_\_\_\_\_\_\_\_\_\_\_\_\_\_\_\_\_\_\_\_\_\_\_\_\_\_\_\_\_  
**Now**

a year and 3 months later, I'm making 23k/m on average with my current offer. I'm no longer working for Michael Blank but 3 months ago, a lead generation company reached out to me through my coach at Elite Closers, and offered me higher commission so I took it. I only take, maybe 29 calls a week (I work 40 hours, each call being 1 hour long, but some people don't show or cancel). People book around my schedule and I can work anywhere I want. I've even taken sales calls on a lake while fishing. I'm so comfortable here and it's something I never thought I'd be doing, let alone from home.

\-

**Things you should know/Tips**

As far as remote is concerned, this is easy work, you're taking calls at home or where-ever you want, people are booking around your schedule, and as long as you're performing, there's no such thing as PTO, time off, sick leave, or vacation time. However, for this to work, the sales aspect is difficult, at least to me. **Here's some things, from my experience, you should know before considering this:**

* This is **NOT** for everyone. High ticket sales without experience or training, can be incredibly difficult. Sure, the $$$ is there, but if it's not something you 100% want to make a career out of and you don't have that ""sales grind"" mindset, this will be a very uphill battle. Especially if you want to do Business to Business sales like I'm doing now, it's a slog to get through, but it pays well.
* Without direct referrals, prior remote sales experience, or a service/agency to vouch for you, getting into remote closing high-ticket sales is damn near impossible. You're fighting for **a remote position**, which everyone wants, for **decent pay**, which everyone wants, **in sales**, which a lot of people already have the skills to do. That might be different from person to person, but I needed to pay for job placements and security through Elite Closers. Without them, I felt like there was nothing I could do.
* You can apply for jobs through Linkedin (I just typed in 'Remote Closer' in the search bar, and a lot of jobs pulled up) or even Indeed, but there are some offers that are scams. On top of that, unless you do your research, the commission they offer, might not actually be what they pay out. So if you do look for these jobs, definitely pull up research on the company before pulling the trigger with them.
* It's 100% remote so there's no hybrid, it's 100% commission base unless you find a company that's willing to offer salary, and it's still technically a part time/full time job. If all 3 of those things work for you, you'll be fine.

\-

If you have any questions about anything, feel free to ask below! **Keep the comments civil!!!** I know some people feel strongly against sales or even the way I went about getting a remote sales job, but it worked for me. I want to help clear up some confusion about this topic and help people make a more educated decision on if remote sales or going through an agency like I did, is worth it for you.",https://www.reddit.com/r/remotework/comments/1bfmej6/i_work_in_remote_sales_as_a_closer_my_story_with/,1710531329.0,9,1,remotework
143o81s,Laid off from NY remote job--which state do I file for unemployment?,"I was recently laid off from my company, which is based in NY. I live in a southern state, and have been remote since I started  the company. I applied for NY unemployment, but I am concerned that my claim may get rejected since I'm not a NY resident. Does anyone have any experience with NY unemployment as an out-of-state resident?

Edit: I called the unemployment office in my state and they said it makes more sense for me to file in NY. They said they have no record of my wages on file.

Edit 2: The unemployment office in NY says that my company stopped reporting my wages back in early
2022 for whatever reason. They're kind of a shady company so I'm suspecting tax fraud. Really hoping this doesn't delay anything, but at least I'm applying in the right state.

Edit 3: Okay, I was approved for NY! Weirdly enough, my HR told me to apply for unemployment in my current state. But after submitting paystubs, NY approved my claim and I am due to get payments starting next week. I was so afraid I'd be in UE purgatory for months. Thanks for the responses everyone!",https://www.reddit.com/r/remotework/comments/143o81s/laid_off_from_ny_remote_jobwhich_state_do_i_file/,1686170206.0,28,17,remotework
1axk6u9,Looking for Part-Time Remote Positions to Supplement my Current Remote Position,"Hi everyone, I have been working from home for CVS since 2021 and I absolutely love it and have no plans on leaving them, and, fortunately, I have a 4-day work week with them which leaves me enough wiggle room for another part time position! I have been looking tirelessly for a part-time remote position to supplement my income with no success. Does anyone have any leads? I have skills in all ov the below:

\-Medical insurance

\-Medical Transcription / Medical Terminology 

\-Data Entry

\-Microsoft Office 

\-Website design

\-Social media marketing

And so much more!!!  ",https://www.reddit.com/r/remotework/comments/1axk6u9/looking_for_parttime_remote_positions_to/,1708641857.0,2,4,remotework
1atcsl1,Why companies of tomorrow WILL be remote,"When you enable your employees to work remotely, you have a choice of the best talent in your country, and in some cases from all over the world.

And conversely, when you do NOT allow your employees to work remotely, you can only choose from the best local talent.

That's all well and good, but there's a big difference

HUGE...

More importantly,

If you allow your employees to work remotely...

You instantly become a preferred choice for all candidates.

How powerful and important is that?

The companies of today that implement a hybrid mode without imposing their bogus rules will be the companies of tomorrow.",https://www.reddit.com/r/remotework/comments/1atcsl1/why_companies_of_tomorrow_will_be_remote/,1708205183.0,73,522,remotework
1844roy,Remote job from APAC,"Hi all, I try to find some remote jobs online but it seems all jobs for people for US, EU,... . Anyone recommend any good sources to find ? ",https://www.reddit.com/r/remotework/comments/1844roy/remote_job_from_apac/,1700981137.0,3,3,remotework
15tz9rf,Remote Jobs,Anyone know of any legit work from home jobs?,https://www.reddit.com/r/remotework/comments/15tz9rf/remote_jobs/,1692305277.0,3,0,remotework
yhr5es,Any unique side remote work jobs?,"I am self employed and working side contractor jobs to support me while I grow my business. 

I have a handful of jobs that require a vehicle but I don't always have access to a car in order to work them. 

So Im looking for ways to work remotely on my own schedule. 

Have you found any unique or unexpected work remotely/Do you know of any remote jobs you can work from home with and choose your own schedule weekly?",https://www.reddit.com/r/remotework/comments/yhr5es/any_unique_side_remote_work_jobs/,1667166956.0,3,6,remotework
18iozjy,Remote Work during 9-5,"Hey Redditors! So some context behind this is I'm a new adult looking to take on some extra workload, I started a new job a few months ago working M-S (60hr weeks).
Within the last two months, l've figured out how to essentially automate all of my workload into about an 1 hour of work per day from myself.
I love the job and couldn't be happier with the pay.
However, I would love to find some sort of side hustle or remote job I could work on at the same time to help increase my savings account! Any recommendations you all have on where I should start looking?",https://www.reddit.com/r/remotework/comments/18iozjy/remote_work_during_95/,1702605612.0,3,1,remotework
zwmrpt,What are 5 surprising remote jobs you can do from home?," 

1. **Virtual Receptionist:** Virtual receptionists provide receptionist services to businesses, taking customer calls and managing customer inquiries. This job requires excellent communication and customer service skills, as well as the ability to manage multiple tasks at once.
2. **Online Tutor:** Online tutoring is a great way to make extra money from home. Tutors are needed to help students of all ages with their school work, as well as teach classes in specialized subject areas like languages, music, or coding.
3. **Social Media Manager:** Companies are increasingly relying on social media to reach their target audiences. As such, there is a need for experienced social media managers who can create campaigns, manage accounts, and track performance.
4. **Web Developer:** Web development is a great way to make money from home. Developers are needed to create user-friendly websites, apps, and software programs.
5. **Data Entry Clerk:** Data entry clerks are responsible for inputting data into a company's systems. This job requires strong attention to detail and the ability to work with a wide range of software programs.",https://www.reddit.com/r/remotework/comments/zwmrpt/what_are_5_surprising_remote_jobs_you_can_do_from/,1672166752.0,0,1,remotework
15bx5nr,Missing remote work culture,"I've been at the same company that I adore for over two years and worked remotely the whole time. About a month ago I changed roles and departments and have found that I'm really struggling with remote work isolation.

I went from having a large engaging remote team (from casual conversations to work conversations) to now being just a dynamic duo with my leader. 

I've tried creating group chats with my coworkers I would consider friends but it's pretty much run dry considering they still have the support and culture I used to have in my old role.

Don't get me wrong I LOVE my new job, love my new boss, I do love working remotely, and am excited to be in this position. But the isolation and sudden lack of work culture is shocking me and hitting me hard since I didn't experience it before even while remote.

Has anyone else experienced this? How did you overcome it?

TD;DR I changed roles at my company and am feeling remote work isolation. Any advice on how to fix this?",https://www.reddit.com/r/remotework/comments/15bx5nr/missing_remote_work_culture/,1690550061.0,6,11,remotework
18cw21r,Less lonely remote working,"I've noticed a recurring theme of loneliness here, and I thought I'd bring to your attention a tool designed to make your remote work experience less lonely.

It is called [Vizor.video](https://www.vizor.video/)

It connects you with colleagues via live video through a virtual frosted glass. 

It assumes you have a team or friends with whom you can collaborate. And if not, maybe someone from this sub want to be your workmate. ;-)

Can this app make you feel less lonely working remotely?",https://www.reddit.com/r/remotework/comments/18cw21r/less_lonely_remote_working/,1701957186.0,1,2,remotework
stnbd2,Work from home - Remote work,Amazon is looking for South Africans with a matric certificate who can work from home. Here is the link: [https://mybroadband.co.za/news/business/433772-amazon-looking-for-south-africans-with-matric-to-work-from-home.html?fbclid=IwAR1oIEfQJE3546fLemYajfiR\_H5pOLgfQ6ieDKLiUMXhoreLcJr5Z9IJa\_8](https://mybroadband.co.za/news/business/433772-amazon-looking-for-south-africans-with-matric-to-work-from-home.html?fbclid=IwAR1oIEfQJE3546fLemYajfiR_H5pOLgfQ6ieDKLiUMXhoreLcJr5Z9IJa_8),https://www.reddit.com/r/remotework/comments/stnbd2/work_from_home_remote_work/,1644987122.0,0,3,remotework
176codg,Does anybody know of any legit remote jobs that don't need much experience?,All these youtube videos seem to be the same about remote working and trying to get you to buy a course. I would hopefully like to find a normal part time or full time job that i can do from home that can be done via computer.,https://www.reddit.com/r/remotework/comments/176codg/does_anybody_know_of_any_legit_remote_jobs_that/,1697132228.0,35,35,remotework
13rg60n,Remote work from the sea?,"Hey, long time creeper first time poster. I've been dreaming for years of moving into my small sailboat and working aboard. Trouble is I am not very techy, and I fear that a customer service job will suck my soul. Just wondering if anyone had any ideas beyond a vlog of some sort. I recently purchased a starlink unit so Internet won't be a problem. Thoughts?",https://www.reddit.com/r/remotework/comments/13rg60n/remote_work_from_the_sea/,1685016894.0,4,5,remotework
18d8r0b,Masters or not? What I really want is a remote job," 

Female engineer- I have an opportunity to get a masters in systems engineering online from a good university through my company (F500). It would be a one year full time program and I would get my full salary at the same time, school would be paid for, and I would not be expected to work while getting the masters. For most people, this would probably be a dream come true no brainer. I would also be required to sign a contract saying that I would stay with the company for two years after the masters or pay back the $35/40k on a sliding scale (ie, if I left after 1 year I would only have to pay half back, 1.5 years pay a quarter back etc). 

There are a few reasons I am hesitating. I would really love to have a remote job, and my company is firmly dedicated to being in person. I also want to start a family in the next two years which would mean I would have to use day care or a nanny. Ideally I would like to either be a stay at home mom or work remotely at home while having a nanny at the same time. Is it possible to request WFM while pregnant and while breastfeeding at companies that are mainly in office? Is it worth the risk of that not being approved?

Also, engineering isn't my passion. I am smart and hard working and wanted a job with stability, so ended up majoring in ME and this job is the best offer I got after graduating. I am finding even with my 3 plus years of experience it's very difficult to find a remote job right now. I'm looking for positions like product manager, project manager, etc. I don't love my job currently. It's fine, my boss really likes me, and I can occasionally work from home, but sometimes people notice. 

I'm on a bit of a deadline as the masters program starts early January. I could withdraw, but I need to confirm at what point the money gets paid and when I would be responsible for paying money back. If I choose to not get the masters, the director is holding a spot for me on the team to stay, but currently they are planning to replace me for the 1 year I am getting my masters so they also need to know. If I don't get the masters, it would give me more time to look for a job, but I just am so tired of this job, that the masters is also appealing just for a change of pace, remote work now for one year, etc. 

I am worried about locking myself into a 2 year contract at a company and job that I don't love. Maybe if I get back from the masters and work 9 months, take 3 months paid plus 3 months unpaid leave, then work 9 months while breastfeeding that's a short enough stretch I could suffer through it. If I absolutely knew I would get approval to work remotely I would do that without question. But it's hard to ask my boss or HR, hey in a year from now when I think I'll be pregnant can I work remotely? Is it worth staying now and trying to find a job I really like that is remote? Those are just so hard to find- both options seem like a gamble. This got long- thanks for any advice!",https://www.reddit.com/r/remotework/comments/18d8r0b/masters_or_not_what_i_really_want_is_a_remote_job/,1701991541.0,2,1,remotework
1631orv,Remote job from another country,"Hi guys, can someone work for a US based company but staying in Nigeria. Like I've never been to the states before even.",https://www.reddit.com/r/remotework/comments/1631orv/remote_job_from_another_country/,1693169514.0,3,0,remotework
1aw4pib,I'm looking for a second part-time that remote job that allows Wi-Fi.,"I found this article. Has anybody worked with these companies and they do in fact allow Wi-Fi?

[https://thinkoutsidethecubiclenow.com/work-from-home-jobs-that-dont-require-hard-wired-internet/](https://thinkoutsidethecubiclenow.com/work-from-home-jobs-that-dont-require-hard-wired-internet/)

Just thought I'd share. ",https://www.reddit.com/r/remotework/comments/1aw4pib/im_looking_for_a_second_parttime_that_remote_job/,1708495186.0,5,2,remotework
15li0ou,"Hello anyone from USA, I got remote jobs for you",nan,https://www.reddit.com/r/remotework/comments/15li0ou/hello_anyone_from_usa_i_got_remote_jobs_for_you/,1691500740.0,39,0,remotework
x2q4zu,Remote work blues and handling office politics,"During the pandemic, I job-hopped more than ever and was hired/onboarded completely remote. I ended up at a company that I really like and support, but my immediate team is really odd. 

My boss is a consultant (not a permanent employee) and she has a lot of bad qualities. In addition to being an extreme micromanager, she has other weird quirks - for instance, she focuses on my emails and how they are too long. She also says I'm not allowed to email anyone unless she signs off on it. Today, we had a project that the CEO asked for and I made the corrections (that she asked me to do), then I sent it back to him because it was time sensitive. She is in a different time zone, but immediately sent back a response (around midnight her time) that I was not allowed to send communications to the CEO without her permission. But ... others in my company do all the time! I talked to one executive who said our CEO would be happy to book time with me to chat. 

My other manager started at this company as an intern and his only work experience is here, but he's not the most helpful person. Often times he tells us wrong information and his attention to detail is lacking. For instance, he is on holiday this week and wouldn't set aside any time to prep me on how to handle certain responsibilities while he was away. He also works hybrid and constantly tells me remote isn't the same, that there is too much room for miscommunication ... but he's kind of a terrible communicator. 

They seem so terrified and there are so many rules. The first boss says things like I shouldn't tell people what we're working on in our department. She constantly rewrites my assignments, but she adds in the wrong details so other departments come back and say we're wrong. She's been in trouble a lot lately and I noticed her interpretation of what happens at work is not true. Like she kept telling us how we need a website developer and we were going to hire one. By how she made it sound, this was certain. Well, the CEO told her no they were not doing that and he chastised her in front of everyone. 

How do I handle a situation like this? It makes me concerned about the stability of my job. She doesn't allow me to connect with others (even on our own team). But still I am a permanent employee and I am being given lots of responsibility. What do you make of it? And how can I improve this situation?",https://www.reddit.com/r/remotework/comments/x2q4zu/remote_work_blues_and_handling_office_politics/,1661983658.0,2,0,remotework
1b9dvtj,Any advice on getting a remote job??,"Hi!! Im not from the US but i  have pretty good level of english and I've been trying to have a remote job because in the situation Im on i just cant do another typo of job, I started applying for jobs on websites and i got to an bilingual interpreter one but it was just too much for me, any website, or maybe a company that could have a remote job? pls help and thanks!!!",https://www.reddit.com/r/remotework/comments/1b9dvtj/any_advice_on_getting_a_remote_job/,1709868500.0,11,0,remotework
1bil4kh,Remote work via vpn,I know this may be a strange question but I was offered a remote position for Arizona however I currently reside in Asia Pacific and I would like to work from Thailand every several months. Way that companies can track where you are if you use A VPN?,https://www.reddit.com/r/remotework/comments/1bil4kh/remote_work_via_vpn/,1710857283.0,2,0,remotework
16utekr,Remote work travel hack,"I'm kicking around idea of using a projector as my monitor(s) for my laptop. I need something where I can compare at least two documents/spreadsheets at same time. Do any of you use anything like that? If so, any tips on brand/model(s)?

Any other tips are welcome as I don't tend to work remotely for longer than a week. I'll be working remotely away from home for a month or two at a time, any advice is welcome.
 
Thanks!",https://www.reddit.com/r/remotework/comments/16utekr/remote_work_travel_hack/,1695939110.0,6,1,remotework
17w4ayi,Looking for fully remote work," 

Hi  guys, im new on reddit. Im trying to find a fully remote position where  i could work from anywhere in the world and im having trouble trying to  narrow down what role i could work towards.

If  i could get some help from y'all with some recommendations with a sure  pathway to working remote be it career suggestion or company.

Im 25 graduated from university but looking for a fully remote position as i want to go travelling. I dont have any skills.

Thanks",https://www.reddit.com/r/remotework/comments/17w4ayi/looking_for_fully_remote_work/,1700083663.0,7,0,remotework
