id,title,selftext,url,created_utc,num_comments,upvotes,subreddit
1akmbpr,U.S. workers are getting scooped up by international companies hiring remote roles,"https://www.cnbc.com/2024/01/25/us-workers-are-getting-remote-jobs-with-international-companies.html

It's getting harder to find a remote job in the U.S., but you might have better luck working from home for a company based abroad.

The number of American workers hired by international companies grew 62% last year, according to the State of Global Hiring Report from Deel, an HR platform that specializes in global hiring.

The report is based on 300,000 contracts between Deel customers and workers for both contractors and full-time employees, and roughly 85% of those contracts are for remote positions.

American workers are most likely to be hired by companies in the U.K., Canada, France, Singapore and Australia.

The spike in U.S. workers vying for remote jobs headquartered overseas ""feels correlated with the elimination of remote roles"" stateside, says Deel CEO Alex Bouaziz. He knows from experience people are quitting jobs with return-to-office requirements to be remote: ""A couple of our competitors did that, and we hired their best people. So I welcome them to keep doing it.""

Workers with unique, in-demand skills being hired internationally

Global employers want to tap into the U.S. talent market because it's so large and has produced some of the most influential companies in the world, Bouaziz says. International bosses want to ""leverage more U.S. talent to bring some of that culture that leads to the biggest enterprises in the world to their home country.""

Americans who work remotely for international employers tend to live in San Francisco, New York, Chicago, Austin and Miami. These U.S. economic powerhouses are ""a playground"" to hire highly knowledgeable workers with ""unique skills"" in product, growth and sales, Bouaziz says. Some of the most common jobs are in research, sales, software engineering, content and product.

""A lot of those companies are thinking, 'How do we build the right playbook that they've done in the U.S.?"" Bouaziz adds. ""One way is to bring U.S. workers to their companies.""

By age, roughly half of American workers with contracts via Deel are between 25 and 34 years old; 18% are between 35 and 44, while 25% are 45 years or older.

The upsides and downsides

Working remotely for an internationally company isn't as straightforward as simply working from home.

Aside from figuring out taxes and other HR compliance issues, Bouaziz says it's important to consider differences in time zones. A Californian working for a company based in Europe may have to adjust to early hours.

A lot also rides on how the company's distributed workforce is set up: Are you the only American employed by a company abroad, or are you part of a larger group stateside? Do you work from home, or will you go into a satellite office? Does your whole team work the same hours, or do you overlap for part of the day and rely on asynchronous work for the other?

Then, cultural differences come into play from the small things (like holiday time off) to the big (communication norms). ""Jumping cultures can be quite intense,"" Bouaziz says. ""It's something you need to be malleable for. It's not hard, but you do need to understand"" and accept norms "" to make everyone comfortable and do their best work while being considerate.""

That being said, accepting the norms of a different country's work culture can also be a big plus. You may enjoy a different style of communication or perspective on work-life balance. Or you might thrive integrating into an organization with more diversity, Bouaziz says, especially if you get to work with colleagues across multiple countries. Those benefits can extend beyond the workplace, he adds: ""Different perspectives help you have a different lens on the world.""

Being able to bring a company to a new U.S. market can be an interesting challenge, he adds, and you may get to be among the first to bring U.S. culture to an international organization.

If you're interested in landing a remote job for a company based abroad, start by using job boards like LinkedIn and filtering for remote jobs based ""worldwide."" Another resource is Otta, which lists jobs at international startups and trending companies that are more likely to have remote flexibility. (For what it's worth, Deel is hiring for 190 open roles around the world, a spokesperson adds.)

Ultimately, ""don't overthink it too much,"" Bouaziz says. ""You'll find that people, wherever you go, tend to be nice.""",https://www.reddit.com/r/WFH/comments/1akmbpr/us_workers_are_getting_scooped_up_by/,1707257566.0,38,315,WFH
ylupro,I need help landing a work from home or remote position.,I've been applying to a lot of different companies for various roles. My application and resume isn't a contender. I have bartending management and serving experience listed as my most recent job titles. What can I do to get an interview? What jobs should I be applying for based on my customer service background?,https://www.reddit.com/r/WFH/comments/ylupro/i_need_help_landing_a_work_from_home_or_remote/,1667556527.0,15,14,WFH
1agevnb,After months and months of searching I finally found a fully remote job with no possibility of RTO.,"The struggle is finally over. My two week notice at my current job ends tomorrow and I'm starting a new fully remote job. I graduated 8 months ago and landed a job that I commuted 1hr 45 mins each way for. I had no life. Now with a fully WFH, I'm hoping my health and fitness will be back on track. 
Please share any tips you have for working from home? Not sure what to expect but excited!",https://www.reddit.com/r/WFH/comments/1agevnb/after_months_and_months_of_searching_i_finally/,1706804648.0,43,318,WFH
10belqq,From Home Office to Remote Oasis: The Search for the Perfect Work-Life Balance Accommodation,nan,/r/digitalnomad/comments/10avcxh/from_home_office_to_remote_oasis_the_search_for/,1673668154.0,0,5,WFH
14bdya9,Seeking Help/Advice landing first fully remote IT HelpDesk Job or any remote work..,"Hi Reddit,

I've come here after being laid off today. I'm trying to brush up on my resume to get a fully remote or Hybrid IT job. I've worked IT for about 10 years now doing stuff like IT in an Amazon FC, Apple Retail Support, and just recently Help Desk Level 2 in a warehouse 3 PL company being the go to for 9 buildings. Any help on how to find my first remote job or any advice about working fully remote IT? This last job near the end I was mainly hybrid so I know how to work from home and manage my schedule. Just lost... I've applied at job listings on ZipRecruiter and Indeed and landed interviews for a few hybrid or in office roles, but looking to really push Remote. I have my CompTIA A+ and will be taking my Net+ end of next month. 

Thank you all!",https://www.reddit.com/r/WFH/comments/14bdya9/seeking_helpadvice_landing_first_fully_remote_it/,1686965782.0,1,4,WFH
17mzflq,200k remote vs 175k hybrid,"I know it sounds like a no brainer but hear me out.

**Hybrid job:** 175k TC with a large multinational corporation. Company has huge brand recognition and would be good to have on my resume. Requires 2-3 days a week on site, the office is about 35 minutes without traffic and about an hour with traffic one way. Sounds horrible but my last job was fully remote and I honestly missed leaving the house and interacting with people. I was laid off from my last job too so the idea of working for a stable MNC sounds kinda nice. The team at this company also seems very enjoyable to work with and despite the traffic, I expect decent work-life-balance. This job is also in a part of town where I have a lot of friends who I don't get to see as much so this will give me more opportunities to do so after work.

**Remote job:** 200k TC with a fifty person start up. The company itself seems like a shit show based on all my interactions with them during the recruiting process. This job will also require lots of early mornings and late nights because I would be working closely with many offshore teams. Its a slightly more senior position than the hybrid job, but it will likely be way more stressful because its a startup and they seem to lack a lot of business processes.

*tl;dr:* A higher paying more stressful job that is fully remote or a more chill, more secure job that pays less but requires a commute",https://www.reddit.com/r/WFH/comments/17mzflq/200k_remote_vs_175k_hybrid/,1699030118.0,61,149,WFH
w36xjp,ONLINE WORK FROM HOME JOBS: Make money online working for Allstate + Paid Training| Remote Jobs 2022,nan,https://youtu.be/QdXdCNwrYLE,1658273550.0,1,0,WFH
15v76yf,Where Should I Look for Remote Work?,"I've been working in banking for the past five years under the impression that moving up in my career would potentially grant me the opportunity to work from home. I've always known banking professionals to work from home and have flexibility. I have always wanted this for myself as my work life balance is important to me. So when everyone got sent home to WFH in 2020 I was so excited! I absolutely loved it and felt more like myself than I ever have. I got to work this way for over two years.

Last year my company announced mandatory RTO two days per week and last week they announced they would be increasing the requirement to three days a week. I am now wondering if eventually I will be working in an office five days a week again. One of the reasons cited in the announcement is that other banks are also requiring three days in office so to remain competitive we will be doing the same.

If banking and finance are moving away from WFH, I don't want to go down this career path anymore. I will do anything to get to work from home again, including a career change. I will go back to school, get certifications, whatever, but I want a career the aligns with the work life balance that I want.

So for those of you who WFH, what field do you work in? What career path should I consider if I value flexibility and remote work? Where do I even look for WFH jobs that aren't a scam?",https://www.reddit.com/r/WFH/comments/15v76yf/where_should_i_look_for_remote_work/,1692422645.0,10,0,WFH
1ajpcwp,Remote access instead of laptop?,I've recently started a new job and for now I'm in the office everyday for training as it's much easier however once training is done we'll be WFH 2/3 days a week. Today I was told the company doesn't give out laptops to employees but the employees remote access the work desktops - (I can't see this being a budgeting issue as it's a global company making billions - and so was curious how this will work? Will I have to use my personal laptop/desktop to work from and if so will they be able to see my files and personal data on these?,https://www.reddit.com/r/WFH/comments/1ajpcwp/remote_access_instead_of_laptop/,1707161824.0,51,25,WFH
18if0jx,Moving to a small town due to my remote job. Family thinks I'm crazy. Any similar stories?,"I've been working remotely for 5+ years, and never liked the area I was in. Lots of family here, but not much to do for us.

I am thinking of moving to a small town area, and it's only a few hours away from a big, big city. 

My husband and I just like the smalll town feel. We like the area when we lived there, and worst case we move to the big city if things don't go well for whatever reason. But yeah, we want to be able to do a lot of things there without having to fly from state to state and it's just a nice place. We're still young, so maybe that's why our families think we're crazy, but in our mindset we have the security money worst case and close to a big city for jobs worst case too. Fam and I are just different, we love them of course!

Any similar stories?",https://www.reddit.com/r/WFH/comments/18if0jx/moving_to_a_small_town_due_to_my_remote_job/,1702578119.0,134,164,WFH
13m217f,New remote position. First time working from home. Looking for suggestions regarding setup/supplies.,"I'm starting a new position next month that will be remote full-time. I'm looking for suggestions regarding supplies to buy or ways to organize my space to make it as functional as possible. Unfortunately, due to the space in my apartment I don't have space for a desk. I'll be doing most of my work from my dining table.",https://www.reddit.com/r/WFH/comments/13m217f/new_remote_position_first_time_working_from_home/,1684517247.0,16,1,WFH
tz4wdi,Work From Home Scams: How to Avoid Fake Remote Jobs,nan,https://remoteworkjunkie.com/work-from-home-scams/,1649428404.0,1,0,WFH
18gt04k,Are hospitals/healthcare systems reluctant to allow remote work?,"I work for a hospital now as an analyst and the implementation of remote work here is inconsistent amongst those who are able to. I'm currently 2 days a week hybrid and even that was an act of god for that to happen. I'm looking for positions elsewhere and from the hospitals I've searched so far in varied places across U.S., there have only been a sparse amount of IT positions that seem to be on board with full remote work (just a few ive seen hybrid). Is anyone else able to confirm what I'm seeing that healthcare IT isn't remote friendly as a whole (or maybe I just need to keep increasing my sample size?).",https://www.reddit.com/r/WFH/comments/18gt04k/are_hospitalshealthcare_systems_reluctant_to/,1702406495.0,38,30,WFH
1abpjnq,"WSJ fear-mongering: When Layoffs Happen, Remote Workers Are Hardest Hit New data shows fully remote employees are more likely to be let go than their peers. They're also more likely to quit.","https://www.wsj.com/lifestyle/careers/layoffs-remote-work-data-980ed59d

https://archive.ph/xfIda

Laying off employees is complicated. New data suggests that managers tend to have an easier time showing remote workers the door.  

Workers logging on from home five days a week were 35% more likely to be laid off in 2023 than their peers who put in office time, according to an analysis of two million white-collar workers conducted by employment data provider Live Data Technologies. The analysis showed 10% of fully remote workers were laid off last year, compared with 7% of those working in an office full time or on a hybrid basis.

""When a hiring manager gets news they have to cut 10% of the staff, it's easier to put someone on the list you don't have a close personal relationship with,"" says Andy Challenger, senior vice president at Challenger, Gray & Christmas, an outplacement firm. Much of the disparity, he says, is that it's simply harder to build attachments to people you don't see face to face.
Some companies have been more intentional about putting remote workers on the chopping block. Wayfair
, the online home-goods retailer, recently told employees that remote workers would be more likely to be affected in company layoffs. Executives also told staff they believe most workers should be in an office most days.

""We went overboard in hiring during a strong economic period and veered away from our core principles,"" Chief Executive Niraj Shah wrote in an earlier staff memo. Wayfair said while the company believes its best work is done in person, it will continue to have remote roles when warranted.

Out of sight, out of mind

Given that many layoffs over the past year have been concentrated in tech--a remote-friendly industry that overhired during the pandemic--it's not surprising that people working exclusively from home have been harder hit, says George Penn, a managing vice president at Gartner
, an advisory firm, who consults with companies on workforce restructuring. 
Other managerial perceptions could be at play, too, he adds. A Gartner survey in 2021 found that 68% of executives and managers believed in-office workers were higher performers than remote employees. 

In Albuquerque, N.M., Liana Robertson, 56 years old, who was laid off this month from her client support job, says she struggled in her fully remote role to get on the same page as her manager.
""Bosses don't think you're actually doing work, because they can't see what you're doing,"" she says. ""They assume everything takes 10 minutes, and why haven't you finished it?"" 
Ron Porter, a Korn Ferry
consultant on workforce issues, says he is hearing from clients that fully remote workers are getting cut more frequently than their in-office and hybrid colleagues. Part of it, he says, is natural human reluctance managers feel to cut those they have to face in person. It's also possible that workers who are remote 100% of the time may be more marginal to start with, he adds, with managers preferring to keep their strongest employees doing the most important tasks close to them at the office when possible.

Easy come, easy go

Alyssa Ciesky, 40, a talent acquisition specialist based in San Antonio, says that as a fully remote worker, she's aware of the risks. ""They're easy to get rid of, you can't put a face to the name, there's no personal connection."" she says of workers like herself. When Ciesky was laid off at the end of 2022 from her fully remote role at a semiconductor company, she says, her manager was based in England. She said she wasn't surprised.
Still, she says that as a mother of two young children, she's willing to take on the prospect of instability for the flexibility of remote work.
""It's worth it,"" she says, adding that she also likes the feeling of autonomy and the ability to focus that working from home offers. 
David Risch, a recruiter in the supply-chain industry, says that especially in today's weaker job market, he cautions candidates to keep their eyes open with all-remote roles.

""We warn them, easy come, easy go,"" he says. ""A company's going to invest in someone who's investing in them."" 

Remote workers are also more likely to quit. According to Live Data Technologies, 12% of fully remote workers left their company and began a new job within two months in 2023, compared with 9% of those who worked on a hybrid or in-person basis. 

Some CEOs say that while they personally don't look at an employee's remote-work status when determining job cuts, they understood why work-from-home status could put them at higher risk. Other data and studies indicate that executives are rewarding in-office employees with promotions and favorable assignments. 
""If you have a person working in finance who's not coming to the office, why wouldn't you hire that same person in India or in the Philippines?"" said Christian Ulbrich, chief executive of real-estate company Jones Lang LaSalle
, noting that in many cases overseas workers can do the same job for less money. 

""If you don't see anybody, somebody at all, you literally may forget how valuable that person is.""

--Chip Cutter contributed to this article.

Write to Te-Ping Chen at Te-ping.Chen@wsj.com",https://www.reddit.com/r/WFH/comments/1abpjnq/wsj_fearmongering_when_layoffs_happen_remote/,1706294517.0,25,79,WFH
1b71sw4,Seeking Advice: Convincing My Workplace to Allow Remote Work,"Hi All,  I recently applied for a role that's traditionally in-office, but after my initial interview, the general manager expressed interest in exploring the option of me working remotely due to my experience. I'm excited about the prospect, but I could use some advice and insights from those who have successfully convinced their workplace to allow remote work.  
The general manager has requested a meeting this week to discuss how the remote work setup would function and has asked me to prepare an outline detailing my thoughts on this transition, including measures of accountability and inclusion.  
If you've been in a similar situation, I'd love to hear about your experience. How did you approach the conversation with your employer? What points did you highlight to demonstrate the feasibility and benefits of remote work? And how did you address concerns about accountability and team inclusion?  
Any tips, advice, or personal anecdotes would be greatly appreciated as I prepare for this meeting. Thanks in advance for your help!",https://www.reddit.com/r/WFH/comments/1b71sw4/seeking_advice_convincing_my_workplace_to_allow/,1709633277.0,17,6,WFH
1aeslcz,Has anyone had to temporarily take an onsite job while immediately looking for remote?,"I hope this isn't against the rules but I really need advice on this and I feel like this is the place to get it. 

I currently work fully remote. My current company was acquired by the same place that acquired my old company and laid me off so I decided it was time to look for a new job, also in the industry I used to work in which is different from where I am now. I've been looking for two months aggressively and had no luck. Hundreds of applications, a few phone screens, and probably 6 interviews two making it to third rounds and getting ghosted or rejected and they just repost the job and don't hire anyone. Apparently others are saying this is a terrible job market right now. I can't even get a hybrid job and before the schedules would be 4 days at home one in office but now that's rare to find apparently and they all want 3+ days in office.

My current job is making me extremely depressed but it's fully remote which helps my depression a little. Going to an office always made/makes me anxious, depressed, and exacerbates my fatigue so when remote work became popular it was a huge relief for my mental health, to the point I have been adamant about never going to an office job again unless I have no choice. I've gotten so desperate to the point I've considered applying to an in person one which I feel like I could get and just continue looking for remote jobs but then I'm worried that would hinder my ability to get one because now I look like a job hopper and they'd ask why am I looking to leave somewhere after only being there three months. And/or being forced to stay 1-2 years because I can't find another job. It feels like a lose lose but the longer I stay here the less experience I have in the field I want to be in and I'm honestly convinced they're going to lay us off any day now. 

Has anyone had to do this and successfully left the onsite job after a short period of time? How did you explain it? Being unemployed isn't an option so to me right now the alternative to quitting is taking an office job and keep looking because apparently the market is so bad that even hybrid jobs are competitive. If my current job was in the industry I'm looking to be in I'd probably just stay but it's not.

Update 2/1/23: my boss just moved me on to a new project today that is even worse than what I was doing before. I'm afraid this is the sign I was looking for to suck it up and apply to something else even if it has to be onsite. ",https://www.reddit.com/r/WFH/comments/1aeslcz/has_anyone_had_to_temporarily_take_an_onsite_job/,1706632453.0,11,14,WFH
tbmpqm,international remote wfh work,"hi everyone,

i started a new job about 6 months ago which has been a 100% wfh position. the company and all the other workers are interstate which makes it difficult to connect with people. 

ive decided to take some annual leave and travel internationally. the plan is to stay overseas and secretly work from home overseas (hopefully they wont find out).

im guessing this wont matter as i work remotely anyways.

has anyone been able to work from home in another country with success?

love to hear any stories/tips",https://www.reddit.com/r/WFH/comments/tbmpqm/international_remote_wfh_work/,1646992205.0,7,3,WFH
qgck2y,Going from a serving job to a remote office job,"I have worked at a restaurant for the last twelve years and recently got a remote office job with an insurance company.  I'm really excited to have a normal schedule and reliable pay but I'm really nervous about how I'll adjust from walking around a restaurant and interacting with people all day to sitting alone and working for 8 hours straight.  

For some context, I live with my parents: my father who also works remote and whose office is down the hall from my bedroom and my mom who doesn't work but does ministry over Zoom along with regular housekeeping duties.  So, I'm not totally alone, but still somewhat isolated.

Any suggestions for adjusting would be greatly appreciated!",https://www.reddit.com/r/WFH/comments/qgck2y/going_from_a_serving_job_to_a_remote_office_job/,1635272185.0,13,28,WFH
